{
  "iep_record_id": "3cdcc86e-fe22-572b-a662-66180d7dc4f2",
  "student_ref": "RIV-2067",
  "disability_category": "Other health impairment (ADHD)",
  "school_year": "2026-2027",
  "accommodations": [
    {
      "id": "578ef63b-c02f-54b2-a1b4-360fbfa19477",
      "text": "Provide 50% extended time on classroom assessments.",
      "applies_to_refs": [
        {
          "scope": "subject",
          "ref": "Mathematics",
          "source_page": 2,
          "source_quote": "Mathematics",
          "confidence": 0.88
        },
        {
          "scope": "subject",
          "ref": "Biology",
          "source_page": 2,
          "source_quote": "Biology",
          "confidence": 0.83
        }
      ],
      "source_page": 2,
      "source_quote": "Provide 50% extended time on classroom assessments.",
      "confidence": 0.79,
      "reconciliation_status": null
    },
    {
      "id": "678cd5c1-7163-56d8-b91c-dbf1c0c9eab5",
      "text": "Provide visual supports and models for new tasks.",
      "applies_to_refs": [
        {
          "scope": "all",
          "ref": "across all classes",
          "source_page": 2,
          "source_quote": "across all classes",
          "confidence": 0.81
        }
      ],
      "source_page": 2,
      "source_quote": "Provide visual supports and models for new tasks.",
      "confidence": 0.78,
      "reconciliation_status": null
    },
    {
      "id": "078bfa53-7f58-51e1-abf7-67e4d619a8b4",
      "text": "Seat with a clear line of sight to the face of the speaker.",
      "applies_to_refs": [
        {
          "scope": "all",
          "ref": "in all settings",
          "source_page": 2,
          "source_quote": "in all settings",
          "confidence": 0.8
        }
      ],
      "source_page": 2,
      "source_quote": "Seat with a clear line of sight to the face of the speaker.",
      "confidence": 0.91,
      "reconciliation_status": null
    },
    {
      "id": "249ff259-e8c9-5805-9d12-c7706f9a44c7",
      "text": "Allow text-to-speech for instructional materials.",
      "applies_to_refs": [
        {
          "scope": "all",
          "ref": "across all classes",
          "source_page": 2,
          "source_quote": "across all classes",
          "confidence": 0.86
        }
      ],
      "source_page": 2,
      "source_quote": "Allow text-to-speech for instructional materials.",
      "confidence": 0.85,
      "reconciliation_status": null
    },
    {
      "id": "c5663a81-cf23-54d3-8000-57142ad3cdd5",
      "text": "Provide frequent check-ins for understanding.",
      "applies_to_refs": [
        {
          "scope": "all",
          "ref": "across all classes",
          "source_page": 2,
          "source_quote": "across all classes",
          "confidence": 0.89
        }
      ],
      "source_page": 2,
      "source_quote": "Provide frequent check-ins for understanding.",
      "confidence": 0.84,
      "reconciliation_status": null
    },
    {
      "id": "d42bbc0f-b7a4-50ee-9c18-d0f095a37d94",
      "text": "Provide captions or a transcript for audio and video media.",
      "applies_to_refs": [
        {
          "scope": "all",
          "ref": "in all settings",
          "source_page": 2,
          "source_quote": "in all settings",
          "confidence": 0.87
        }
      ],
      "source_page": 2,
      "source_quote": "Provide captions or a transcript for audio and video media.",
      "confidence": 0.82,
      "reconciliation_status": null
    },
    {
      "id": "b4739675-add4-5939-ad76-94dc1831bde7",
      "text": "Accept typed responses in place of extended handwriting.",
      "applies_to_refs": [
        {
          "scope": "subject",
          "ref": "English",
          "source_page": 2,
          "source_quote": "English",
          "confidence": 0.91
        },
        {
          "scope": "context",
          "ref": "during written assignments",
          "source_page": 2,
          "source_quote": "during written assignments",
          "confidence": 0.81
        }
      ],
      "source_page": 2,
      "source_quote": "Accept typed responses in place of extended handwriting.",
      "confidence": 0.8,
      "reconciliation_status": null
    },
    {
      "id": "63e2f48f-9bfd-5857-beb2-ee70fa6dcb64",
      "text": "Provide a word bank for written-response items.",
      "applies_to_refs": [
        {
          "scope": "all",
          "ref": "across all classes",
          "source_page": 2,
          "source_quote": "across all classes",
          "confidence": 0.77
        }
      ],
      "source_page": 2,
      "source_quote": "Provide a word bank for written-response items.",
      "confidence": 0.9,
      "reconciliation_status": null
    }
  ],
  "services": [
    {
      "id": "b5ea4fc6-bccf-5c92-9fd7-489d5239635a",
      "type": "Language processing support (group)",
      "minutes_per_week": 60,
      "frequency": "30 minutes, 2 times weekly",
      "provider_role": "Unassigned",
      "start": "2026-08-17",
      "end": "2027-05-28",
      "source_page": 3,
      "source_quote": "Language processing support (group): 60 minutes per week; 30 minutes, 2 times weekly; provider: Unassigned.",
      "confidence": 0.79,
      "reconciliation_status": null
    },
    {
      "id": "668fb82f-d24c-5b25-a1f3-d06228921c6d",
      "type": "Occupational therapy",
      "minutes_per_week": 30,
      "frequency": "30 minutes, 1 time weekly",
      "provider_role": "Occupational therapist",
      "start": "2026-08-17",
      "end": "2027-05-28",
      "source_page": 3,
      "source_quote": "Occupational therapy: 30 minutes per week; 30 minutes, 1 time weekly; provider: Occupational therapist.",
      "confidence": 0.9,
      "reconciliation_status": null
    }
  ],
  "goals": [
    {
      "id": "3bf1f138-3d77-54e6-81bc-9b66ed1a3721",
      "text": "Grace will accept a change in routine using a coping strategy in 4 of 5 opportunities.",
      "baseline": "Accepts a change in routine in 2 of 5 opportunities.",
      "target": "4 of 5 opportunities.",
      "measure": "Teacher observation",
      "progress_cadence": "Weekly",
      "source_page": 4,
      "source_quote": "Grace will accept a change in routine using a coping strategy in 4 of 5 opportunities.",
      "confidence": 0.9,
      "reconciliation_status": null
    },
    {
      "id": "9b8854b5-860a-5db5-87e5-78111fdf516b",
      "text": "Diego will write a paragraph with a clear topic sentence and three details in 4 of 5 samples.",
      "baseline": "Writes a paragraph with a topic sentence in 1 of 5 samples.",
      "target": "4 of 5 samples.",
      "measure": "Writing work sample",
      "progress_cadence": "Monthly",
      "source_page": 4,
      "source_quote": "Diego will write a paragraph with a clear topic sentence and three details in 4 of 5 samples.",
      "confidence": 0.93,
      "reconciliation_status": null
    },
    {
      "id": "02de5025-df38-5ad9-88d3-8fe3099a86c3",
      "text": "Marcus will use a taught script to join a peer activity in 3 of 4 structured opportunities.",
      "baseline": "Joins a peer activity with adult prompting in 1 of 4 opportunities.",
      "target": "3 of 4 structured opportunities.",
      "measure": "Structured social observation",
      "progress_cadence": "Weekly",
      "source_page": 4,
      "source_quote": "Marcus will use a taught script to join a peer activity in 3 of 4 structured opportunities.",
      "confidence": 0.84,
      "reconciliation_status": null
    },
    {
      "id": "94c5a5b8-b99a-5d96-99ea-b440b5dbbe35",
      "text": "Sofia will retell a short narrative with a beginning, middle, and end in 4 of 5 opportunities.",
      "baseline": "Retells a narrative with only a beginning in 2 of 5 opportunities.",
      "target": "4 of 5 opportunities.",
      "measure": "Language sample",
      "progress_cadence": "Every two weeks",
      "source_page": 4,
      "source_quote": "Sofia will retell a short narrative with a beginning, middle, and end in 4 of 5 opportunities.",
      "confidence": 0.95,
      "reconciliation_status": null
    },
    {
      "id": "20f5286b-3cfd-5780-9f94-640773b392ea",
      "text": "Given a grade-level text, Aanya will identify the main idea and two supporting details with 80% accuracy.",
      "baseline": "Identifies the main idea with 40% accuracy.",
      "target": "80% accuracy across three consecutive assessments.",
      "measure": "Reading comprehension work sample",
      "progress_cadence": "Every two weeks",
      "source_page": 4,
      "source_quote": "Given a grade-level text, Aanya will identify the main idea and two supporting details with 80% accuracy.",
      "confidence": 0.83,
      "reconciliation_status": null
    }
  ],
  "dates": {
    "annual_review": "2027-05-19",
    "triennial_reeval": "2026-11-18",
    "last_progress_report": "2026-10-09"
  },
  "field_confidences": {
    "student_ref": 0.99,
    "disability_category": 0.93,
    "school_year": 0.99,
    "annual_review": 0.88,
    "triennial_reeval": 0.94,
    "last_progress_report": 0.9
  },
  "extraction_meta": {
    "model": "ground-truth/hand-authored-v1",
    "run_id": "508d5d07-c89d-59c6-825e-dda0f685c2c1",
    "page_count": 4,
    "legibility_scores": [
      1.0,
      0.98,
      0.97,
      0.98
    ],
    "extracted_at": "2026-07-19T00:00:00Z"
  }
}
