{
  "iep_record_id": "ce3cb99a-958f-51d1-b18b-7b5f07d9da54",
  "student_ref": "RIV-2007",
  "disability_category": "Other health impairment (ADHD)",
  "school_year": "2026-2027",
  "accommodations": [
    {
      "id": "1a1dc3fd-30ce-5759-9fa5-e6989b300468",
      "text": "Permit brief movement breaks between tasks.",
      "applies_to_refs": [
        {
          "scope": "context",
          "ref": "between classroom tasks",
          "source_page": 2,
          "source_quote": "between classroom tasks",
          "confidence": 0.82
        }
      ],
      "source_page": 2,
      "source_quote": "Permit brief movement breaks between tasks.",
      "confidence": 0.84,
      "reconciliation_status": null
    },
    {
      "id": "876ee676-eef0-54b5-96cc-1387ebaae114",
      "text": "Provide frequent check-ins for understanding.",
      "applies_to_refs": [
        {
          "scope": "all",
          "ref": "across all classes",
          "source_page": 2,
          "source_quote": "across all classes",
          "confidence": 0.8
        }
      ],
      "source_page": 2,
      "source_quote": "Provide frequent check-ins for understanding.",
      "confidence": 0.97,
      "reconciliation_status": null
    },
    {
      "id": "236974d8-87ac-5bdd-af7a-37f04e39ccd6",
      "text": "State task expectations explicitly and in writing.",
      "applies_to_refs": [
        {
          "scope": "all",
          "ref": "in all settings",
          "source_page": 2,
          "source_quote": "in all settings",
          "confidence": 0.96
        }
      ],
      "source_page": 2,
      "source_quote": "State task expectations explicitly and in writing.",
      "confidence": 0.8,
      "reconciliation_status": null
    },
    {
      "id": "3b2422f6-f51e-5134-957a-78a556b5298d",
      "text": "Break multi-step directions into chunked, numbered steps.",
      "applies_to_refs": [
        {
          "scope": "all",
          "ref": "across all classes",
          "source_page": 2,
          "source_quote": "across all classes",
          "confidence": 0.92
        }
      ],
      "source_page": 2,
      "source_quote": "Break multi-step directions into chunked, numbered steps.",
      "confidence": 0.9,
      "reconciliation_status": null
    },
    {
      "id": "6625201d-5d03-5dc0-ade0-4be8b8e5feb6",
      "text": "Provide a peer notetaker or copy of lecture notes.",
      "applies_to_refs": [
        {
          "scope": "subject",
          "ref": "English",
          "source_page": 2,
          "source_quote": "English",
          "confidence": 0.81
        },
        {
          "scope": "subject",
          "ref": "World History",
          "source_page": 2,
          "source_quote": "World History",
          "confidence": 0.89
        }
      ],
      "source_page": 2,
      "source_quote": "Provide a peer notetaker or copy of lecture notes.",
      "confidence": 0.88,
      "reconciliation_status": null
    },
    {
      "id": "3eb23660-0e2c-56df-a927-e4ac8891bf01",
      "text": "Check the daily planner for recorded homework before dismissal.",
      "applies_to_refs": [
        {
          "scope": "context",
          "ref": "before dismissal",
          "source_page": 2,
          "source_quote": "before dismissal",
          "confidence": 0.79
        }
      ],
      "source_page": 2,
      "source_quote": "Check the daily planner for recorded homework before dismissal.",
      "confidence": 0.86,
      "reconciliation_status": null
    },
    {
      "id": "19b2acc8-4709-5006-9197-e4bfd2263648",
      "text": "Provide a checklist to break long assignments into steps.",
      "applies_to_refs": [
        {
          "scope": "context",
          "ref": "during long assignments",
          "source_page": 2,
          "source_quote": "during long assignments",
          "confidence": 0.79
        }
      ],
      "source_page": 2,
      "source_quote": "Provide a checklist to break long assignments into steps.",
      "confidence": 0.9,
      "reconciliation_status": null
    },
    {
      "id": "e872ba8b-498d-562e-8800-5252de9aba24",
      "text": "Do not penalize articulation errors in graded oral work.",
      "applies_to_refs": [
        {
          "scope": "subject",
          "ref": "English",
          "source_page": 2,
          "source_quote": "English",
          "confidence": 0.94
        },
        {
          "scope": "context",
          "ref": "during oral presentations",
          "source_page": 2,
          "source_quote": "during oral presentations",
          "confidence": 0.96
        }
      ],
      "source_page": 2,
      "source_quote": "Do not penalize articulation errors in graded oral work.",
      "confidence": 0.8,
      "reconciliation_status": null
    },
    {
      "id": "d6b48955-ce12-5936-bf33-e603a9917489",
      "text": "Seat near the point of instruction and away from high-traffic areas.",
      "applies_to_refs": [
        {
          "scope": "all",
          "ref": "in all settings",
          "source_page": 2,
          "source_quote": "in all settings",
          "confidence": 0.84
        }
      ],
      "source_page": 2,
      "source_quote": "Seat near the point of instruction and away from high-traffic areas.",
      "confidence": 0.82,
      "reconciliation_status": null
    }
  ],
  "services": [
    {
      "id": "554d9e4d-7296-5bd8-8749-efb39caa5add",
      "type": "Language processing support (group)",
      "minutes_per_week": 60,
      "frequency": "30 minutes, 2 times weekly",
      "provider_role": "Unassigned",
      "start": "2026-08-17",
      "end": "2027-05-28",
      "source_page": 3,
      "source_quote": "Language processing support (group): 60 minutes per week; 30 minutes, 2 times weekly; provider: Unassigned.",
      "confidence": 0.91,
      "reconciliation_status": null
    },
    {
      "id": "94aa201d-c6bf-5fe5-86f1-039b4be82853",
      "type": "Speech and language therapy",
      "minutes_per_week": 60,
      "frequency": "30 minutes, 2 times weekly",
      "provider_role": "Speech-language pathologist",
      "start": "2026-08-17",
      "end": "2027-05-28",
      "source_page": 3,
      "source_quote": "Speech and language therapy: 60 minutes per week; 30 minutes, 2 times weekly; provider: Speech-language pathologist.",
      "confidence": 0.94,
      "reconciliation_status": null
    }
  ],
  "goals": [
    {
      "id": "ee6d5899-fa0e-5882-ad29-72377a0f09cf",
      "text": "Oscar will maintain a topic across three conversational turns in 4 of 5 opportunities.",
      "baseline": "Maintains a topic for one turn in 2 of 5 opportunities.",
      "target": "4 of 5 opportunities.",
      "measure": "Structured social observation",
      "progress_cadence": "Weekly",
      "source_page": 4,
      "source_quote": "Oscar will maintain a topic across three conversational turns in 4 of 5 opportunities.",
      "confidence": 0.93,
      "reconciliation_status": null
    },
    {
      "id": "caf365e3-95df-5071-b909-f3b09ee96d08",
      "text": "Marcus will independently begin a classroom task within two minutes of the direction in 4 of 5 opportunities.",
      "baseline": "Begins a task within two minutes in 1 of 5 opportunities.",
      "target": "4 of 5 opportunities across two weeks.",
      "measure": "Teacher observation checklist",
      "progress_cadence": "Weekly",
      "source_page": 4,
      "source_quote": "Marcus will independently begin a classroom task within two minutes of the direction in 4 of 5 opportunities.",
      "confidence": 0.84,
      "reconciliation_status": null
    },
    {
      "id": "aca06fd2-04c4-5ba2-ae39-5d2d5817cfe8",
      "text": "Grace will accept a change in routine using a coping strategy in 4 of 5 opportunities.",
      "baseline": "Accepts a change in routine in 2 of 5 opportunities.",
      "target": "4 of 5 opportunities.",
      "measure": "Teacher observation",
      "progress_cadence": "Weekly",
      "source_page": 4,
      "source_quote": "Grace will accept a change in routine using a coping strategy in 4 of 5 opportunities.",
      "confidence": 0.82,
      "reconciliation_status": null
    },
    {
      "id": "6125379b-9c7d-592b-8aca-9b5afa74b3fc",
      "text": "Noah will sustain attention to an independent task for 10 minutes in 4 of 5 opportunities.",
      "baseline": "Sustains attention for 3 minutes in 2 of 5 opportunities.",
      "target": "4 of 5 opportunities.",
      "measure": "Teacher observation",
      "progress_cadence": "Weekly",
      "source_page": 4,
      "source_quote": "Noah will sustain attention to an independent task for 10 minutes in 4 of 5 opportunities.",
      "confidence": 0.94,
      "reconciliation_status": null
    }
  ],
  "dates": {
    "annual_review": "2026-11-03",
    "triennial_reeval": "2029-03-30",
    "last_progress_report": "2026-10-16"
  },
  "field_confidences": {
    "student_ref": 0.99,
    "disability_category": 0.91,
    "school_year": 0.99,
    "annual_review": 0.95,
    "triennial_reeval": 0.93,
    "last_progress_report": 0.88
  },
  "extraction_meta": {
    "model": "ground-truth/hand-authored-v1",
    "run_id": "421a18e0-5eab-5ff5-855d-bb255d9e9784",
    "page_count": 4,
    "legibility_scores": [
      1.0,
      0.98,
      0.97,
      0.98
    ],
    "extracted_at": "2026-07-19T00:00:00Z"
  }
}
